{
  "schemaVersion": "certification-manual-source-v2",
  "batchId": "aws-saa-c03-2026-08-15-AWSSAA-N18-B06",
  "trackId": "aws-certified-solutions-architect-associate",
  "familyId": "certification",
  "contentVersion": "aws-certified-solutions-architect-associate-authoring-v2026.08.15",
  "taxonomyVersion": "aws-saa-c03-20-node-v2026.08.15",
  "nodeId": "compute_cost_optimization_purchasing_rightsizing_and_availability",
  "learningBlockId": "load_balancer_and_availability_cost",
  "slotIds": [
    "AWSSAA-N18-B06:01",
    "AWSSAA-N18-B06:02",
    "AWSSAA-N18-B06:03",
    "AWSSAA-N18-B06:04",
    "AWSSAA-N18-B06:05",
    "AWSSAA-N18-B06:06",
    "AWSSAA-N18-B06:07",
    "AWSSAA-N18-B06:08",
    "AWSSAA-N18-B06:09",
    "AWSSAA-N18-B06:10",
    "AWSSAA-N18-B06:11",
    "AWSSAA-N18-B06:12",
    "AWSSAA-N18-B06:13",
    "AWSSAA-N18-B06:14",
    "AWSSAA-N18-B06:15",
    "AWSSAA-N18-B06:16",
    "AWSSAA-N18-B06:17",
    "AWSSAA-N18-B06:18",
    "AWSSAA-N18-B06:19",
    "AWSSAA-N18-B06:20"
  ],
  "items": [
    {
      "itemId": "aws-saa-c03-AWSSAA-N18-B06-001",
      "slotId": "AWSSAA-N18-B06:01",
      "nodeId": "compute_cost_optimization_purchasing_rightsizing_and_availability",
      "learningBlockId": "load_balancer_and_availability_cost",
      "taxonomy": {
        "examDomainId": "aws-saa-c03-domain-4",
        "competencyAreaId": "compute_cost_optimization_purchasing_rightsizing_and_availability",
        "topicId": "load_balancer_and_availability_cost",
        "skillAtomId": "alb_vs_nlb_cost"
      },
      "prompt": "An HTTP application needs path routing, TLS termination, and content-aware health checks Which choice best meets the requirement?",
      "constraints": [
        "The protocol is HTTP.",
        "Layer-7 routing matters.",
        "The target is horizontally scalable."
      ],
      "interaction": {
        "type": "choice",
        "selectionMode": "single",
        "options": [
          {
            "optionId": "A",
            "text": "Evaluate an Application Load Balancer and model LCUs, targets, cross-AZ transfer, TLS, and health-check cost against the required routing features."
          },
          {
            "optionId": "B",
            "text": "Use NLB solely because it is always cheaper."
          },
          {
            "optionId": "C",
            "text": "Use a gateway load balancer for HTTP path routing."
          },
          {
            "optionId": "D",
            "text": "Expose every instance publicly and remove health checks."
          }
        ],
        "acceptedOptionIds": [
          "A"
        ]
      },
      "scoringContract": {
        "type": "choice",
        "resultSemantics": "exact_selected_set_with_partial_v1",
        "selectionMode": "single"
      },
      "feedback": {
        "Reason": "The decision preserves the alb_vs_nlb_cost boundary and treats compute cost together with the workload's availability and performance contract.",
        "Details": {
          "mechanismOrProperty": "AWS pricing, capacity, scaling, and placement behavior must be matched to the measurable workload requirement in the scenario.",
          "scenarioApplication": "The owner measures utilization, latency, interruption, demand, or recovery evidence and verifies the selected capacity against the stated objective.",
          "errorCorrection": "The distractors ignore a commitment, utilization, startup, failure, or cost boundary and would create either waste or an unsafe degraded state.",
          "boundaryOrTradeoff": "Load-balancer cost and capability are tied to protocol and routing layer, not a universal price ranking.",
          "url": "https://docs.aws.amazon.com/elasticloadbalancing/latest/userguide/what-is-load-balancing.html"
        },
        "wrongOptionExplanationsByOptionId": {
          "B": "This option ignores the alb_vs_nlb_cost decision boundary and cannot satisfy the stated workload safely or economically.",
          "C": "This option ignores the alb_vs_nlb_cost decision boundary and cannot satisfy the stated workload safely or economically.",
          "D": "This option ignores the alb_vs_nlb_cost decision boundary and cannot satisfy the stated workload safely or economically."
        },
        "omittedCorrectElementExplanationsByOptionId": {}
      },
      "modeEligibility": [
        "certification-focus-practice",
        "certification-scenario-practice",
        "certification-mixed-practice",
        "certification-exam-simulation",
        "certification-weak-area-review"
      ],
      "sourceBinding": {
        "bindingId": "AWSSAA-N18-B06:01:source-binding",
        "claimIds": [
          "aws-saa-c03-4.4"
        ],
        "anchorIds": [
          "01"
        ],
        "sourceRefs": [
          "https://docs.aws.amazon.com/elasticloadbalancing/latest/userguide/what-is-load-balancing.html"
        ]
      },
      "authoringProvenance": {
        "authoringMethod": "manual",
        "approvalStatus": "unapproved",
        "author": "Codex",
        "createdAt": "2026-08-15T00:00:00Z",
        "contentBatchId": "aws-saa-c03-2026-08-15-AWSSAA-N18-B06"
      }
    },
    {
      "itemId": "aws-saa-c03-AWSSAA-N18-B06-002",
      "slotId": "AWSSAA-N18-B06:02",
      "nodeId": "compute_cost_optimization_purchasing_rightsizing_and_availability",
      "learningBlockId": "load_balancer_and_availability_cost",
      "taxonomy": {
        "examDomainId": "aws-saa-c03-domain-4",
        "competencyAreaId": "compute_cost_optimization_purchasing_rightsizing_and_availability",
        "topicId": "load_balancer_and_availability_cost",
        "skillAtomId": "nlb_static_ip"
      },
      "prompt": "A TCP service needs static IPs, very high connection rates, and preserves client source IP Which choice best meets the requirement?",
      "constraints": [
        "The protocol is TCP.",
        "Static addresses matter.",
        "Connection scale is high."
      ],
      "interaction": {
        "type": "choice",
        "selectionMode": "single",
        "options": [
          {
            "optionId": "A",
            "text": "Evaluate a Network Load Balancer and include processed bytes, cross-zone behavior, target capacity, and availability in the cost model."
          },
          {
            "optionId": "B",
            "text": "Use ALB without checking static-IP and TCP semantics."
          },
          {
            "optionId": "C",
            "text": "Use a public instance IP per target as the failover design."
          },
          {
            "optionId": "D",
            "text": "Use CloudFront for a non-HTTP TCP protocol."
          }
        ],
        "acceptedOptionIds": [
          "A"
        ]
      },
      "scoringContract": {
        "type": "choice",
        "resultSemantics": "exact_selected_set_with_partial_v1",
        "selectionMode": "single"
      },
      "feedback": {
        "Reason": "The decision preserves the nlb_static_ip boundary and treats compute cost together with the workload's availability and performance contract.",
        "Details": {
          "mechanismOrProperty": "AWS pricing, capacity, scaling, and placement behavior must be matched to the measurable workload requirement in the scenario.",
          "scenarioApplication": "The owner measures utilization, latency, interruption, demand, or recovery evidence and verifies the selected capacity against the stated objective.",
          "errorCorrection": "The distractors ignore a commitment, utilization, startup, failure, or cost boundary and would create either waste or an unsafe degraded state.",
          "boundaryOrTradeoff": "NLB fits transport-layer and static-address requirements but has its own processed-byte and availability cost.",
          "url": "https://docs.aws.amazon.com/elasticloadbalancing/latest/userguide/what-is-load-balancing.html"
        },
        "wrongOptionExplanationsByOptionId": {
          "B": "This option ignores the nlb_static_ip decision boundary and cannot satisfy the stated workload safely or economically.",
          "C": "This option ignores the nlb_static_ip decision boundary and cannot satisfy the stated workload safely or economically.",
          "D": "This option ignores the nlb_static_ip decision boundary and cannot satisfy the stated workload safely or economically."
        },
        "omittedCorrectElementExplanationsByOptionId": {}
      },
      "modeEligibility": [
        "certification-focus-practice",
        "certification-scenario-practice",
        "certification-mixed-practice",
        "certification-exam-simulation",
        "certification-weak-area-review"
      ],
      "sourceBinding": {
        "bindingId": "AWSSAA-N18-B06:02:source-binding",
        "claimIds": [
          "aws-saa-c03-4.4"
        ],
        "anchorIds": [
          "02"
        ],
        "sourceRefs": [
          "https://docs.aws.amazon.com/elasticloadbalancing/latest/userguide/what-is-load-balancing.html"
        ]
      },
      "authoringProvenance": {
        "authoringMethod": "manual",
        "approvalStatus": "unapproved",
        "author": "Codex",
        "createdAt": "2026-08-15T00:00:00Z",
        "contentBatchId": "aws-saa-c03-2026-08-15-AWSSAA-N18-B06"
      }
    },
    {
      "itemId": "aws-saa-c03-AWSSAA-N18-B06-003",
      "slotId": "AWSSAA-N18-B06:03",
      "nodeId": "compute_cost_optimization_purchasing_rightsizing_and_availability",
      "learningBlockId": "load_balancer_and_availability_cost",
      "taxonomy": {
        "examDomainId": "aws-saa-c03-domain-4",
        "competencyAreaId": "compute_cost_optimization_purchasing_rightsizing_and_availability",
        "topicId": "load_balancer_and_availability_cost",
        "skillAtomId": "gateway_load_balancer"
      },
      "prompt": "A security appliance fleet must inspect traffic transparently and scale independently of application targets Which choice best meets the requirement?",
      "constraints": [